n,Festus,,,"Festus replaced Felix as Roman governor over Judea in the year 62. He left Paul in prison at Cesaria, until he sent Paul to Rome to be judged by Caesar, the Roman emperor.",,,,GC 7/7/2019,,,,,,,,,,,,,,,,,,,,,,,
t,fig,figs,fig (R); ,Fig is a kind of fruit tree. Its fruit is very sweet.,,,,,,,,,,,,,,,,,,,,,,,,,,,
t,fool,"foolish, fools, fooled","the one who doesn't really know things (G); 
","A fool is anyone who makes poor/stupid/bad choices, even when others warn him. God want fools to repent, to learn wisdom and to obey him. The book of Proverbs often contrasts foolish people and wise people.",wise,,GC 19-Feb-2019,,,,,,,,,,,,,,,,,,,,,,,,
t,forgive,"forgiven, forgives, forgiveness",erase (R); put arm around their shoulders (S-I);,"To forgive is to choose not to punish those who have sinned or disobeyed. When forgiven, those who did wrong no longer have guilt or shame for what they had done.","guilt, shame, cleanse, sanctify",,,,,,,,,,,,,,,,,,,,,,,,,,
t,form,"formed, forms",,"To form something means (1) to change its shape to look like something else (e.g. clay can be formed to look like an image of something), or (2) to bring people together in a new group.","carve,
 build,
",,GC 23-Feb-2019,,,,,,,,,,,,,,,,,,,,,,,,
t,fox,foxes,fox (G); ,"A fox is a wild animal like a small dog with beautiful fur, a bushy tail, sharp teeth and non-retractible claws.  Foxes hunt with stealth like a cat and eat smaller animals like rats, mice, snakes and rabbits.  Some cultures use the fox in a metaphorical way to describe attributes like beauty, cunning, wise or tricky.  For example, if a woman is beautiful, she might be called a fox.  King Herod was called a fox, meaning Herod was wiley or dangerously tricky.",,,,,,,,,,,,,,,,,,,,,,,,,,,
t,frankincense,,"sticky substance whose smoke smells good (R); 
 powder cooked/burned and its smoke smells good and it is called insens (K)","Frankincense is good smelling powder made of sap of a tree. When it is burned, it makes a sweet smell. Because the Jews had to bring it from a distance, it was expensive.",incense,good smelling powder made of sap of a tree (Hilkka),,,,,,,,,,,,,,,,,,,,,,,,,
t,furnace,kiln,fire (W);,"A furnace is place or large box in which one burns wood or another fuel to produce high heat, like a kiln for curing bricks or pottery.  (The Babylonians disposed of dead bodies by cremation, by burning them in a furnace.) (Craftsmen used furnaces to purify metals such as silver or gold.) ",,,,,,,,,,,,,,,,,,,,,,,,,,,
n,Gadarene,Gadarenes,,Garadene was a region near the Lake Galilee where there were many Gentile people who ate pig meat.,,,GC 08-Mar-2019,,,,,,,,,,,,,,,,,,,,,,,,
n,Galilee,,,Galilee was a region or province in the northern part of Israel around a very large lake called the Sea of Galilee. It has many fish.,,,,,,,,,,,,,,,,,,,,,,,,,,,
n,Gehazi,,,Gehazi was a servant of the prophet Elisha. He once sinned by asking for a gift from a Syrian offcial whom Elisha had healed of leprosy.,,,GC 07-Feb-19,,,,,,,,,,,,,,,,,,,,,,,,
t,gentile,gentiles,"who is not a Jew (W); 
people who are not Jews (R); ","Gentiles are all groups and individuals who are  neither Israelites nor Jews. In Jesus' time, most Gentiles worshipped false gods and idols. (Before Jesus returned to heaven, he commanded his apostles to go make disciples for him amongst all the Gentile nations.)
Sometimes, the term gentile is used in a generic sense in the New Testament to refer to a category of people who do not believe or belong to God.","Jew, Hebrews","can be translated also with their nationality, e.g. Kenan/Greek… (Hilkka)","I am not aware of a figurative use of the term Gentile in the NT.         RR:  Perhaps generic sense is better than figurative.  Gentile is used for the category of ""sinner"" or unbeliever (even though all ethnic Gentiles are not unbelievers), as Jew is sometimes used in a generic sense for the category of ""belonging to God"" or ""believer"" (even though all ethnic Jews do not believe) e.g. Rev 2:9; 3:9
GC: Good!",,,,,,,,,,,,,,,,,,,,,,,,
n,Gibea,"Gibeon, Gibeonites",,Gibea was a pagan city in Canaan when Joshua and the Israelites were conquering the land. (The Gibeonites deceived Joshua to make a peace pact with them.),,,Let the Bible tell the story.,07 July 2019,,,,,,,,,,,,,,,,,,,,,,,
n,Gibea,"Gibeon, Gibeonites",,"The Gibeonites were Canaanites from Gibea town who pretended to be from outside of Canaan, in order to make peace with Joshua and his army. Because the Israelists forgot to ask God, they were deceived by the Gibeonites and made peace with them, even though they really were Canaanites.",,,GC 07-Feb-19,,,,,,,,,,,,,,,,,,,,,,,,
n,Gideon,,,"Gideon lived around 1200 years before Jesus. He was a farmer who became a leader or judge over the Israelites, after he led a small army against a big enemy army. (God frightened the big army so that it fled away.)",,,,,,,,,,,,,,,,,,,,,,,,,,,
t,glory,"glorified, glorify","light;
greatness;
praise (give glory to God);
strength and/or beauty (G);
allah (W); decoration/beauty (R);","Glory means (1) great power, (2) bright light, (3) beauty and (4) the presence of God.",,References to Allah/islam not helpful in PNG ,,,,,,,,,,,,,,,,,,,,,,,,,
t,goat,goats,deer-like animal with long hair (G); ,"Goats are gentle animals whose meat and milk people eat. Goats often dwell in same herds with sheep. Sheep tails hang downwards, whilst goat tails curl upwards. Adult male goats, called rams, will fight using their horns, and are a symbol for nations that go to war.","sheep, shepherd",,GC 08-Mar-2019,,,,,,,,,,,,,,,,,,,,,,,,
t,God,Eternal God,"eternal one;
Creator; 
the God who lives / has lived forever (G); God (R); Allah (W);","God is the One Great, Eternal Spirit who created everything and all living creatures. God rules over heaven and earth. He has commanded everyone to abandon their gods and to worship only him. (There is no other god as great as he.) (This One Great God came into the world as a human being, Jesus the Messiah.)","Lord, idol, gods",Arabic ref.,,,,,,,,,,,,,,,,,,,,,,,,,
t,gold,golden,,Gold and silver are shiny metals that many countries use as money and use to make jewelry. The Israelite Ark of the Covenant was covered with shiny gold. Gold is mined from the earth.  To purify it requires heating it with a very hot fire until it melts and the dirt can be separated from it.,"silver, ",,GC 07-Feb-19,,,,,,,,,,,,,,,,,,,,,,,,
n,Gomorrah,,,"Gomorrah was a city near Sodom where Abraham's nephew Lot chose to live. The population was so evil, that God destroyed it with fire that fell from the sky (around 2000 years before Jesus lived).",,,,,,,,,,,,,,,,,,,,,,,,,,,
t,good,,"good (G);
","People call ""good"" anything and anyone that they evaluate to be right, true, honest, kind or useful. To be ""just"" or ""right"" means to have a good standing with God or to follow his laws.","right, just",,GC 08-Mar-2019,,,,,,,,,,,,,,,,,,,,,,,,
t,gospel,good news,"Good Report (W);
beautiful speech (G);good telling (R); 
 good talk (K);","Gospel means Good News. It is the message (from Jesus’ apostles) that God forgives the sins and gives eternal life to all who repent and put their faith in Jesus, who died on a cross, was buried, rose three days after, and appeared to many eye-witnesses.",,,,,,,,,,,,,,,,,,,,,,,,,,,
t,governor,,"ruling person (of a region);
chief (of the people in a country) (G);big leader from the government (R); kilifa (W from Arabic)",Governors are officials who rule over a region or part of a nation. Only a king has more power.,"king, leader
",arabic ref.,,,,,,,,,,,,,,,,,,,,,,,,,
t,grace,gracious,"forgive; make good;
coming/falling onto (to help/aid/show mercy to someone);
and nobody pays for it (W);
pity and patience (for people) (G);love/pity (K); like (K)
","Grace is the love that God has for us humans, by which he forgives us, rescues us from harm, helps us lead a better life, gives us power to serve him, and will bring us into his eternal kingdom.","forgive, mercy, love","also, make good (Hilkka)",,,,,,,,,,,,,,,,,,,,,,,,,
t,grapes,grape,wine seeds (R); ,"Grapes are a kind of fruit that grow on a vine, not a tree. Their juice is used to make wine. (The Jews used to plant many vines on their farms and cultivate them so that they would bear plenty of fruit.)","grapevine, wine",reseng not helpful in PNG,,,,,,,,,,,,,,,,,,,,,,,,,
n,Greece,Greek,,"Greece is a country in Europe. Athens and Corinth cities are in Greece. Around 350 years before Jesus, Greece conquered Israel and many other countries. Most of those countries began speaking and reading the Greek language. The New Testament books are written in Greek. Greek was language of scholars, not ordinary people's mother tongue",,"Greek was language of scholars, not ordinary people's mother tongue (Hilkka)",,,,,,,,,,,,,,,,,,,,,,,,,
t,guilt,guilty,"the condition of having done something bad (G); 
that deseriving death (W);","Guilt means someone has violated or broken a law. A guilty person is someone who has broken a law. All humans become guilty before God when they begin to break his laws. All guilty people must be punished.  The consequence of guilt is punishment.  Usually, a person who is guilty will feel shame.","forgive, shame, sanctify","this is an exception, very strong: that deserving death (W); (Hilkka)",GC 15-Feb-2019,,,,,,,,,,,,,,,,,,,,,,,,
n,Hagar,,,"Hagar lived around 2000 years ago. She was a slave girl in the house of Sarah, Abraham's wife. At the time when Sarah had not yet borne a child, she asked Abraham to lie with Hagar, and Hagar bore a child who was named Ishmael. (But Ishmael was not the child whom God had promised to give to Abraham with Sarah. Twelve years later, Sarah bore a son with Abraham who named him Isaac. Isaac is the son whom God had promised.)",,,,,,,,,,,,,,,,,,,,,,,,,,,
t,hail,,ice stones; frozen rain stones,Hail consists of frozen chunks of water (ice) that fall from the sky like rain; hard frozen rain.,,,,,,,,,,,,,,,,,,,,,,,,,,,
n,Haman,,,"Haman was a descendent of pagan king Agag who hated Israel. When Persian King Xerxes made him an official, Haman set about to kill Mordecai and all Jews in the Persian Empire.",,,GC 08-Mar-2019,,,,,,,,,,,,,,,,,,,,,,,,
n,Hannah,,,"Hannah was a co-wife of Elkanah. She had no child until she prayed to the Lord at Shiloh. She bore a son named Samuel who became a prophet over Israel. (The name Hannah means ""grace"".)",,,,GC 7/7/2019,,,,,,,,,,,,,,,,,,,,,,,
n,Hanun,,,An Ammonite King who shamed David's ambassadors.,,,,,,,,,,,,,,,,,,,,,,,,,,,
n,Haran,,,There were several men and a city named Haran. One Haran was a brother of Abraham and father of Lot..  The city called Haran was where Abram's father died.,,,GC 07-Feb-19,,,,,,,,,,,,,,,,,,,,,,,,
t,heaven,"heavens, sky","the Above;
sky;
way up high (G); heaven (R); ","Heaven means everything that is above the ground or earth, including the air, the clouds, the sky, God’s unseen city, and all creatures that dwell there. ",earth,try to separate heaven and sky; asaman not helpful in PNG,,,,,,,,,,,,,,,,,,,,,,,,,
n,Hebrews,"Hebrews, Jew, Jews, Jewish, Israelites","Jew-people; Jew-talk;
","Hebrew means Abraham’s descendants (the twelve tribes) and their language, whom God chose to be his special nation. The Hebrews later were called Israelites (after God changed Jacob's name to Israel) and still later Jews (because many Israelites lived in Judah/Jewdah).","gentile, Israelite, Jew",,,,,,,,,,,,,,,,,,,,,,,,,,
n,Hebron,,,There were two towns (cities) named Hebron. Abraham and Jacob worshipped God near Hebron in Canaan. King David often went to Hebron in Judah.,,,GC 19-Feb-2019,,,,,,,,,,,,,,,,,,,,,,,,
t,herd,herds,,"A herd is a group of animals, especially domesticated (non wild) animals with hoofs that people (shepherds) keep together and look after as livestock to support themselves.",shepherd; livestock,,,,,,,,,,,,,,,,,,,,,,,,,,
n,Hermes,,,"Hermes, who is also called Mercury, was a Greek and Roman god that, pagans believed, served as a messenger for other gods.",,,,,,,,,,,,,,,,,,,,,,,,,,,
n,Herod,,,"Herod is the family name of kings whom the Romans put in power over parts of Israel. Four of those kings were (1) Herod the Great in Judea (King during the time Jesus was a baby), (2) Herod Antipas in Galilee (who ruled during the time Jesus was preaching), 3) Herod Agrippa the First  in Judea (who ruled after Jesus' resurrection and persecuted the early Christians) and (4) Herod Agrippa the Second in Judea (who ruled during the time Paul was being tried).",,,,,,,,,,,,,,,,,,,,,,,,,,,
t,High Priest,Chief Priest,leader of the giving to God ones (R); head man of priests (U), The High (Chief) Priest was the leader of all the priests. The High Priest was the only person permitted to go into the Most Holy Place in the Tabernacle or Temple where he would sacrifice to God for his own sins and the sins the people had done.,priest,other language: head man of priests (Urt),,,,,,,,,,,,,,,,,,,,,,,,,
t,holy,"holiness, holies, holiest, ","unique;
set apart / special / sacred; 
pure or having no sin/guilt/moral fault;
belonging to God (associated with God);
staying away from bad things/deeds (G);
Pure (W); belonging to God (R); clean (R); straight (k);","Holy means (1) pure, clean, (2) forgiven; (3) unique, different from others; set apart; dedicated or belonging to God, and (4) faithful to God. Jesus was called the Holy One, and God himself is called the Holy Spirit. (The Bible calls Christians Saints, which means Holy people.)","Holy Spirit, sin, sinful , saint",,,,,,,,,,,,,,,,,,,,,,,,,,
t,Holy Spirit,"God's Spirit, Spirit of Jesus, Jesus' Spirit, God's Holy Spirit","God's Spirit;
God's breath;
the Attractive/Good Spirit (G);
Spirit of Jesus;
The Pure Breath (W); Straight Spirit (R); bright/perfect breath/wind (U)","Because God is holy, and God is a Spirit, the bible calls God the Holy Spirit. As Jesus was God with us in visible form, so the Holy Spirit is God with us in unseen form. (Jesus promised that the Holy Spirit would come abide with those who have faith in Jesus.)

",spirit ,other language: bright/perfect breath/wind (urt),,,,,,,,,,,,,,,,,,,,,,,,,
t,honor,"honorable, honored","honor / speak well of (G); 
stay under authority / have first place / lift up/praise name of / make happy (U)t","To honor someone is to tell how great or good a person is, or to show respect for a person's age, wisdom or authority.","worship, praise, thank","other language: stay under authority (urt), have first place (urt), lift up/praise name of (urt), make happy (urt)",GC 23-Feb-2019,,,,,,,,,,,,,,,,,,,,,,,,
t,horse,horses,,"Horses are big, strong, fast running animals that humans can ride on.  They can be made to pull wagons and chariots, or to carry loads. Horses come in many sizes, but they are generally shorter than camels and bigger than donkeys. ",,,GC 15-Feb-2019,,,,,,,,,,,,,,,,,,,,,,,,
t,hosanna,,osaana (R); praise / be happy with (U);,"""Hosanna"" is a greeting that Jews used to shout to give honor to their king. It means ""May God save him!"". ",,"praise (urt), be happy with (urt)",,,,,,,,,,,,,,,,,,,,,,,,,
t,hyssop,,(little) tree called isop (K); ,"Hyssop is a kind of plant. Israel's priests used to dip a hyssop leaf into blood from a sacrifice, then sprinkle people or things with the blood to make them holy in the sight of God.",,"Hyssop is a shrub, not a tree.",,,,,,,,,,,,,,,,,,,,,,,,,
t,idol,"idols, gods","(carved/man-made) image worshipped by people;
image;
false god (G, K);
carving (W, R)","Idols are objects that folk desire more than they desire God. An idol is a created, visible image made to represent something not usually visible.  Some folk carve idols from wood or from stone. Folk believe that a god or a spirit comes and dwells in the idol, so they pray to the idol, supposing that the god will hear them.","God,",,"False only in the sense that they are not Yahweh, the incomparable Creator. The spirits of gods do exist and pagans do pray to them.",,,,,,,,,,,,,,,,,,,,,,,,
t,incense,,"sticky substance whose smoke smells good (R); 
 powder cooked/burned and its smoke smells good and it is called insens (K)",Incense is the sap or parts of a tree that smell sweet when burned. Many religions burn insence while worsipping their gods.,frankincense,,,,,,,,,,,,,,,,,,,,,,,,,,
t,iron,,,"Iron is a strong metal useful to make tools, weapons, war carts or chariots (to be pulled by horses) and chains.",,,,GC 7/7/2019,,,,,,,,,,,,,,,,,,,,,,,
n,Isaac,,,"Isaac lived about 1900 years before Jesus. Isaac was the son that God promised to Abraham that his wife Sarah would bear. Isaac is also the son whom Abraham offered to sacrifice to the Lord God. (When Sarah heard God's promise that she would bear a son even though she was already old, she laughed. Isaac means laughter.)",,,The spirit of Antichrist has promulgathed a false docrine that Abraham offered his bastard son Ishmael.,,,,,,,,,,,,,,,,,,,,,,,,
n,Isaiah,,,"Isaiah lived around 800 years before Jesus. He often spoke to the kings of Judah, and wrote the Book of Isaiah, making many predictions about the Messiah. Jesus said that Isaiah wrote about him.",,,,,,,,,,,,,,,,,,,,,,,,,,,
t,Israel,"Israelite, Israelites",,"Israelites are descended from Jacob whose name became Israel. Israelites were members of the country called Israel. (After the tribes invaded Canaan, they named their nation Israel.) After the country split in two, northerers were called Israelites and southeners called Judeans. ","Hebrew, Jew",,GC 23-Feb-2019,,,,,,,,,,,,,,,,,,,,,,,,
n,Jabin,,,"Jaban was a Canaanite king whose army oppressed the Israelites. After they prayed to the Lord, the Israelites defeated Jabin's army and killed him.",,,GC 07-Feb-19,,,,,,,,,,,,,,,,,,,,,,,,
n,Jacob,,,"Jacob lived about 1850 years before Jesus. He was a son of Isaac and grandson of Abraham. After Jabob wrestled with an angel from God, the angel have him a new name, Israel. Israel's twelve sons became the ancestors of the twelve tribes of Israel. (Thus, the Israelites are sometimes called the House of Jacob.)",Israel,,,,,,,,,,,,,,,,,,,,,,,,,,
n,Jael,,,"Jael was a Kenite woman whose clan lived in Israel but was at peace with the Canaanites. When Sisera fled from the Israelite army he took refuge in Jael's tent, where she killed him as he slept. (The name Jael means ""The Lord is God"".)",,,"Yah is often assumed to be a short form of Yahweh, even though other nations myths mention a deity called Yah or Yeh.",GC 7/7/2019,,,,,,,,,,,,,,,,,,,,,,,
t,jail,"jails, prison, prisons, imprisoned, jailed","place where one is emprisoned (G);
","A jail or prison is a small house or room in which governments lock up criminals or those accused of a crime. Joseph was locked up in a jail in Egypt, Peter in a jail in Jerusalem, and Paul in a jail in Rome.  A person who is locked up in a jail is called a prisoner.  A person who is in authority over a jail or prison is called a jailor.",chain,,GC 19-Feb-2019,,,,,,,,,,,,,,,,,,,,,,,,
n,James,,,There were several men named James. Two were a Apostles. Another was Jesus' brother James who later became a Christian and a leader in the churches at Jerusalem. (The Hebrew form of James is Jacob which means Surplanter.),,,GC 08-Mar-2019,,,,,,,,,,,,,,,,,,,,,,,,
t ,jealous,jealousy,,"Jealousy can mean (1) to feel badly or angry when someone else succeeds or gets what you want, (2) to envy others, or (3) to desire what they have. Jealousy can lead you to sin. God feels jealous when his people worship other gods.",,,The slant (/) has no meaning.,,"Key Term Database including back translation contributions from the following languages: Daasanach (D), Wolof (W), Guajajara (G), Kandas (K) and Ramoaaina (R). © 2019 Wycliffe Bible Translators, Inc.",,,,,,,,,,,,,,,,,,,,,,
n,Jehoachin,"Jehoiachin, Coniah",,"Jehoachin, also called Coniah and Jehoiachin, was king of Judah (southern Israel) when a Babylonian army invaded and capture the City of Jerusalem 598 years before Christ.",,,,GC 7/7/2019,,,,,,,,,,,,,,,,,,,,,,,
n,Jehoiada,,,Jehoiada was high priest in the temple at Jerusalem before and during the reign of King Joash. His wife rescued baby Joash from being killed by evil Queen Athaliah.,,,,GC 7/7/2019,,,,,,,,,,,,,,,,,,,,,,,
n,Jephthah,,,"Jephthah lived about 1700 years before Jesus during the time of the judges. He became the leader of the Israelite's army, leading it to victory.",,,,,,,,,,,,,,,,,,,,,,,,,,,
n,Jeremiah,,,"Jeremiah lived around 600 years before Jesus, before and during the time when Israel was destroyed by Babylon. He was a prophet of God who called the Israelites to repent of their disobedience, warning them that the Bablonians would come capture Jerusalem and take them into captivity for 70 years.",,,,,,,,,,,,,,,,,,,,,,,,,,,
n,Jericho,,,"Jericho was the name of a strong, walled city in Canaan. It was where Rahab lived. Jericho was the first city that Joshua and the Israelites defeated with God's miraculous help. God caused the walls of Jericho to fall down.",,,Good as is.,,,,,,,,,,,,,,,,,,,,,,,,
n,Jeroboam,,,"After King Soloman died, his kingdom was divided in two. Jeroboam became king over the northern part, which they called Israel. Jeroboam told the Israelites to stop going to Jerusalem, and to worship the Lord by bowing to idols that looked like a bull, and he made himself to be a priest. These actions displeased the Lord. Jeroboam was a wicked king.",,,GC 19-Feb-2019,,,,,,,,,,,,,,,,,,,,,,,,
n,Jerusalem,,,"After king David captured Jerusalem, it became Israel's capital city. (The name Jerusalem means Peace City.)  King Solomon built a temple for God at Jerusalem. For 1000 years, Jerusalem city remained the central place of worship for Jews. Another name for Jerusalem is Mount Zion, because it is located on a hill. Jerusalem has been destroyed and rebuilt several times. ",Zion,, ,,,,,,,,,,,,,,,,,,,,,,,,
n,Jesse,,,"Jesse was the father of King David, who was an ancestor of Jesus Christ. In the Old Testament, the prophet Isaiah had written that the Messiah or Christ would be a descendant of Jesse and of David.",,,,,,,,,,,,,,,,,,,,,,,,,,,
n,Jesus,,"Yeesu in Roman script, Isaa in Arabic script (W);","(An angel told Mary and Joseph to name her son) Jesus, which means ""God Saves""  because he would save people from their sins. Jesus is the promised Messiah or Christ. He is God come in human flesh, the only Saviour. (He worked miracles on earth, he died because of our sins, he rose to life three days later, and he has ascended into heaven from whence he will return one day to judge the living and the dead and to continue ruling over the kingdom which he is even now in the process of building). Some other titles which are given to Jesus are: Jesus Christ, Messiah, Son of God, Son of Man, Son of David.",,Arabic ref.,,,,,,,,,,,,,,,,,,,,,,,,,
n,Jethro,Reuel,,"Jethro was the title of a priest of Midian. His personal name was Reuel (Ex. 4.18). Moses married one of Jethro's daughters in about 1400 BCE. (The name Reuel means ""friend of God"".)",,,,GC 7/7/2019,,,,,,,,,,,,,,,,,,,,,,,
n,Jew,"Jews, Jewish, Hebrews",people (a tribe) called Jews; sons of Israel (W);,"The Jews were descendants from Abraham and Jacob, also called Israel. They lived in the land called Judah, thus the title Jews. The Jews were known as ""God's people"" because God chose them to be the nation through whom he would make himself known and through whom the Messiah would be born. God chose Israel, the Jews, to be a light to all the nations, to show God to all the world. The ethnic Jews did not do that. So God sent Jesus, born as a Jew, to fulfill his purpose to bring light and life to all the nations in the world. Jesus taught that a ""true"" Jew was not an ethnic descendant from Abraham, but rather any person (no matter their biological ethnicity) who trusted and obeyed God like Abraham did.  ","Gentile, Israelite","I would leave this out from notes: Sometimes the term ""Jew"" is used figuratively/generically in the New Testament to refer to believers, Christians, people who truly belong to God. (Hilkka)",,,,,,,,,,,,,,,,,,,,,,,,,
t,Jewel,"jewels, gem, gems, gemstone, gemstones",stone (R); beads (R); stones you pay big money (U);,"Jewels are beautiful stones of difference colours, that cost a lot of money. The high priest of Israel wore jewels on his breast plate (to symbolize the 12 tribes of Israel). The New Jerusalem is described in the Book of Revelation as having walls made of jewels.",,other language: stones you pay big money,,,,,,,,,,,,,,,,,,,,,,,,,
t,Jewish Religious Leaders,"Religious Leader, Religious Leaders, Jewish religious leader","leaders of Jews who believe in God (G); 
","Jewish religious leaders included priests, rabbis, scribes and teachers who were supposed to help others understand and obey God's laws. Many such leaders disbelieved in Jesus and tried to harm Jews who became Christians.","pharisee, Sadducee",,GC 15-Feb-2019,,,,,,,,,,,,,,,,,,,,,,,,
n,Joab,,,Joab was a loyal commander over David's army for many years.,,,GC 07-Feb-19,,,,,,,,,,,,,,,,,,,,,,,,
n,Joash,Jehoash,,"Joash was a king of Judah (Southern Israel) about 800 years before Christ. While young, he served the Lord, but when old, he did evil and was killed.",,,GC 07-Feb-19,,,,,,,,,,,,,,,,,,,,,,,,
n,Job,,,"Job was a famous, rich, godly, good man who lived long, long ago. After enemies stole all of his wealth and Satan killed his children, he became very sick. His friends accused him of secret sins, but Job knew he was a good man, so he wanted to ask God why he was suffering. After he became humble, God restored his health and his wealth, and he had more children.",,,GC 19-Feb-2019,,,,,,,,,,,,,,,,,,,,,,,,
